{
  "document_id": "010_picture_of_dorian_gray",
  "title": "The Picture of Dorian Gray",
  "author": "Oscar Wilde",
  "source_file": "pictureofdoriang0000osca_s9a9.pdf",
  "edition_notes": "Ward Lock and Bowden 1891 edition (248 pages). Contains Preface and 20 Chapters.",
  "human_verified": true,
  "verification_coverage": "human_verified_full",
  "structural_notes": "Single-tier chapter structure (Preface + 20 chapters). Headings in this edition use small-caps styling which caused parser misses in the v1 baseline.",
  "scored_levels": [
    "preface",
    "chapter"
  ],
  "deferred_levels": [],
  "benchmark_status": "active",
  "nodes": [
    {
      "node_id": "dg_preface",
      "parent_id": null,
      "title": "The Preface",
      "type": "preface",
      "level": 1,
      "order": 1,
      "page_start": 5,
      "page_end": 7,
      "verification_status": "human_verified",
      "verification_notes": "Oscar Wilde's aphoristic Preface on pages 5-7.",
      "benchmark_status": "scored"
    },
    {
      "node_id": "dg_ch_1",
      "parent_id": null,
      "title": "Chapter 1",
      "type": "chapter",
      "level": 1,
      "order": 2,
      "page_start": 9,
      "page_end": null,
      "verification_status": "human_verified",
      "verification_notes": "Chapter 1 body heading (styled in small-caps in source PDF).",
      "benchmark_status": "scored"
    },
    {
      "node_id": "dg_ch_2",
      "parent_id": null,
      "title": "Chapter 2",
      "type": "chapter",
      "level": 1,
      "order": 3,
      "page_start": 25,
      "page_end": null,
      "verification_status": "human_verified",
      "verification_notes": "Chapter 2 body heading (styled in small-caps in source PDF).",
      "benchmark_status": "scored"
    },
    {
      "node_id": "dg_ch_3",
      "parent_id": null,
      "title": "Chapter 3",
      "type": "chapter",
      "level": 1,
      "order": 4,
      "page_start": 41,
      "page_end": null,
      "verification_status": "human_verified",
      "verification_notes": "Chapter 3 body heading (styled in small-caps in source PDF).",
      "benchmark_status": "scored"
    },
    {
      "node_id": "dg_ch_4",
      "parent_id": null,
      "title": "Chapter 4",
      "type": "chapter",
      "level": 1,
      "order": 5,
      "page_start": 55,
      "page_end": null,
      "verification_status": "human_verified",
      "verification_notes": "Chapter 4 body heading (styled in small-caps in source PDF).",
      "benchmark_status": "scored"
    },
    {
      "node_id": "dg_ch_5",
      "parent_id": null,
      "title": "Chapter 5",
      "type": "chapter",
      "level": 1,
      "order": 6,
      "page_start": 73,
      "page_end": null,
      "verification_status": "human_verified",
      "verification_notes": "Chapter 5 body heading (styled in small-caps in source PDF).",
      "benchmark_status": "scored"
    },
    {
      "node_id": "dg_ch_6",
      "parent_id": null,
      "title": "Chapter 6",
      "type": "chapter",
      "level": 1,
      "order": 7,
      "page_start": 85,
      "page_end": null,
      "verification_status": "human_verified",
      "verification_notes": "Chapter 6 body heading (styled in small-caps in source PDF).",
      "benchmark_status": "scored"
    },
    {
      "node_id": "dg_ch_7",
      "parent_id": null,
      "title": "Chapter 7",
      "type": "chapter",
      "level": 1,
      "order": 8,
      "page_start": 96,
      "page_end": null,
      "verification_status": "human_verified",
      "verification_notes": "Chapter 7 body heading (styled in small-caps in source PDF).",
      "benchmark_status": "scored"
    },
    {
      "node_id": "dg_ch_8",
      "parent_id": null,
      "title": "Chapter 8",
      "type": "chapter",
      "level": 1,
      "order": 9,
      "page_start": 110,
      "page_end": null,
      "verification_status": "human_verified",
      "verification_notes": "Chapter 8 body heading (styled in small-caps in source PDF).",
      "benchmark_status": "scored"
    },
    {
      "node_id": "dg_ch_9",
      "parent_id": null,
      "title": "Chapter 9",
      "type": "chapter",
      "level": 1,
      "order": 10,
      "page_start": 124,
      "page_end": null,
      "verification_status": "human_verified",
      "verification_notes": "Chapter 9 body heading (styled in small-caps in source PDF).",
      "benchmark_status": "scored"
    },
    {
      "node_id": "dg_ch_10",
      "parent_id": null,
      "title": "Chapter 10",
      "type": "chapter",
      "level": 1,
      "order": 11,
      "page_start": 137,
      "page_end": null,
      "verification_status": "human_verified",
      "verification_notes": "Chapter 10 body heading (styled in small-caps in source PDF).",
      "benchmark_status": "scored"
    },
    {
      "node_id": "dg_ch_11",
      "parent_id": null,
      "title": "Chapter 11",
      "type": "chapter",
      "level": 1,
      "order": 12,
      "page_start": 147,
      "page_end": null,
      "verification_status": "human_verified",
      "verification_notes": "Chapter 11 body heading (styled in small-caps in source PDF).",
      "benchmark_status": "scored"
    },
    {
      "node_id": "dg_ch_12",
      "parent_id": null,
      "title": "Chapter 12",
      "type": "chapter",
      "level": 1,
      "order": 13,
      "page_start": 166,
      "page_end": null,
      "verification_status": "human_verified",
      "verification_notes": "Chapter 12 body heading (styled in small-caps in source PDF).",
      "benchmark_status": "scored"
    },
    {
      "node_id": "dg_ch_13",
      "parent_id": null,
      "title": "Chapter 13",
      "type": "chapter",
      "level": 1,
      "order": 14,
      "page_start": 175,
      "page_end": null,
      "verification_status": "human_verified",
      "verification_notes": "Chapter 13 body heading (styled in small-caps in source PDF).",
      "benchmark_status": "scored"
    },
    {
      "node_id": "dg_ch_14",
      "parent_id": null,
      "title": "Chapter 14",
      "type": "chapter",
      "level": 1,
      "order": 15,
      "page_start": 185,
      "page_end": null,
      "verification_status": "human_verified",
      "verification_notes": "Chapter 14 body heading (styled in small-caps in source PDF).",
      "benchmark_status": "scored"
    },
    {
      "node_id": "dg_ch_15",
      "parent_id": null,
      "title": "Chapter 15",
      "type": "chapter",
      "level": 1,
      "order": 16,
      "page_start": 198,
      "page_end": null,
      "verification_status": "human_verified",
      "verification_notes": "Chapter 15 body heading (styled in small-caps in source PDF).",
      "benchmark_status": "scored"
    },
    {
      "node_id": "dg_ch_16",
      "parent_id": null,
      "title": "Chapter 16",
      "type": "chapter",
      "level": 1,
      "order": 17,
      "page_start": 209,
      "page_end": null,
      "verification_status": "human_verified",
      "verification_notes": "Chapter 16 body heading (styled in small-caps in source PDF).",
      "benchmark_status": "scored"
    },
    {
      "node_id": "dg_ch_17",
      "parent_id": null,
      "title": "Chapter 17",
      "type": "chapter",
      "level": 1,
      "order": 18,
      "page_start": 219,
      "page_end": null,
      "verification_status": "human_verified",
      "verification_notes": "Chapter 17 body heading (styled in small-caps in source PDF).",
      "benchmark_status": "scored"
    },
    {
      "node_id": "dg_ch_18",
      "parent_id": null,
      "title": "Chapter 18",
      "type": "chapter",
      "level": 1,
      "order": 19,
      "page_start": 227,
      "page_end": null,
      "verification_status": "human_verified",
      "verification_notes": "Chapter 18 body heading (styled in small-caps in source PDF).",
      "benchmark_status": "scored"
    },
    {
      "node_id": "dg_ch_19",
      "parent_id": null,
      "title": "Chapter 19",
      "type": "chapter",
      "level": 1,
      "order": 20,
      "page_start": 235,
      "page_end": null,
      "verification_status": "human_verified",
      "verification_notes": "Chapter 19 body heading (styled in small-caps in source PDF).",
      "benchmark_status": "scored"
    },
    {
      "node_id": "dg_ch_20",
      "parent_id": null,
      "title": "Chapter 20",
      "type": "chapter",
      "level": 1,
      "order": 21,
      "page_start": 244,
      "page_end": null,
      "verification_status": "human_verified",
      "verification_notes": "Chapter 20 body heading (styled in small-caps in source PDF).",
      "benchmark_status": "scored"
    }
  ]
}