{
  "document_id": "003_the_time_machine",
  "title": "The Time Machine",
  "author": "H.G. Wells",
  "source_file": "Wells_1922_Time_Machine.pdf",
  "edition_notes": "Heinemann 1922 edition (221 pages). Contains 16 Chapters and an Epilogue.",
  "human_verified": true,
  "verification_coverage": "human_verified_full",
  "structural_notes": "Standard single-tier chapter structure (16 chapters + epilogue). Parser successfully extracts body chapters; minor TOC noise on front pages.",
  "scored_levels": [
    "chapter",
    "epilogue"
  ],
  "deferred_levels": [],
  "benchmark_status": "active",
  "nodes": [
    {
      "node_id": "tm_ch_1",
      "parent_id": null,
      "title": "Chapter 1",
      "type": "chapter",
      "level": 1,
      "order": 1,
      "page_start": 9,
      "page_end": null,
      "verification_status": "human_verified",
      "verification_notes": "Chapter 1 heading.",
      "benchmark_status": "scored"
    },
    {
      "node_id": "tm_ch_2",
      "parent_id": null,
      "title": "Chapter 2",
      "type": "chapter",
      "level": 1,
      "order": 2,
      "page_start": 17,
      "page_end": null,
      "verification_status": "human_verified",
      "verification_notes": "Chapter 2 heading.",
      "benchmark_status": "scored"
    },
    {
      "node_id": "tm_ch_3",
      "parent_id": null,
      "title": "Chapter 3",
      "type": "chapter",
      "level": 1,
      "order": 3,
      "page_start": 26,
      "page_end": null,
      "verification_status": "human_verified",
      "verification_notes": "Chapter 3 heading.",
      "benchmark_status": "scored"
    },
    {
      "node_id": "tm_ch_4",
      "parent_id": null,
      "title": "Chapter 4",
      "type": "chapter",
      "level": 1,
      "order": 4,
      "page_start": 33,
      "page_end": null,
      "verification_status": "human_verified",
      "verification_notes": "Chapter 4 heading.",
      "benchmark_status": "scored"
    },
    {
      "node_id": "tm_ch_5",
      "parent_id": null,
      "title": "Chapter 5",
      "type": "chapter",
      "level": 1,
      "order": 5,
      "page_start": 44,
      "page_end": null,
      "verification_status": "human_verified",
      "verification_notes": "Chapter 5 heading.",
      "benchmark_status": "scored"
    },
    {
      "node_id": "tm_ch_6",
      "parent_id": null,
      "title": "Chapter 6",
      "type": "chapter",
      "level": 1,
      "order": 6,
      "page_start": 59,
      "page_end": null,
      "verification_status": "human_verified",
      "verification_notes": "Chapter 6 heading.",
      "benchmark_status": "scored"
    },
    {
      "node_id": "tm_ch_7",
      "parent_id": null,
      "title": "Chapter 7",
      "type": "chapter",
      "level": 1,
      "order": 7,
      "page_start": 69,
      "page_end": null,
      "verification_status": "human_verified",
      "verification_notes": "Chapter 7 heading.",
      "benchmark_status": "scored"
    },
    {
      "node_id": "tm_ch_8",
      "parent_id": null,
      "title": "Chapter 8",
      "type": "chapter",
      "level": 1,
      "order": 8,
      "page_start": 78,
      "page_end": null,
      "verification_status": "human_verified",
      "verification_notes": "Chapter 8 heading.",
      "benchmark_status": "scored"
    },
    {
      "node_id": "tm_ch_9",
      "parent_id": null,
      "title": "Chapter 9",
      "type": "chapter",
      "level": 1,
      "order": 9,
      "page_start": 86,
      "page_end": null,
      "verification_status": "human_verified",
      "verification_notes": "Chapter 9 heading.",
      "benchmark_status": "scored"
    },
    {
      "node_id": "tm_ch_10",
      "parent_id": null,
      "title": "Chapter 10",
      "type": "chapter",
      "level": 1,
      "order": 10,
      "page_start": 96,
      "page_end": null,
      "verification_status": "human_verified",
      "verification_notes": "Chapter 10 heading.",
      "benchmark_status": "scored"
    },
    {
      "node_id": "tm_ch_11",
      "parent_id": null,
      "title": "Chapter 11",
      "type": "chapter",
      "level": 1,
      "order": 11,
      "page_start": 107,
      "page_end": null,
      "verification_status": "human_verified",
      "verification_notes": "Chapter 11 heading.",
      "benchmark_status": "scored"
    },
    {
      "node_id": "tm_ch_12",
      "parent_id": null,
      "title": "Chapter 12",
      "type": "chapter",
      "level": 1,
      "order": 12,
      "page_start": 114,
      "page_end": null,
      "verification_status": "human_verified",
      "verification_notes": "Chapter 12 heading.",
      "benchmark_status": "scored"
    },
    {
      "node_id": "tm_ch_13",
      "parent_id": null,
      "title": "Chapter 13",
      "type": "chapter",
      "level": 1,
      "order": 13,
      "page_start": 123,
      "page_end": null,
      "verification_status": "human_verified",
      "verification_notes": "Chapter 13 heading.",
      "benchmark_status": "scored"
    },
    {
      "node_id": "tm_ch_14",
      "parent_id": null,
      "title": "Chapter 14",
      "type": "chapter",
      "level": 1,
      "order": 14,
      "page_start": 131,
      "page_end": null,
      "verification_status": "human_verified",
      "verification_notes": "Chapter 14 heading.",
      "benchmark_status": "scored"
    },
    {
      "node_id": "tm_ch_15",
      "parent_id": null,
      "title": "Chapter 15",
      "type": "chapter",
      "level": 1,
      "order": 15,
      "page_start": 137,
      "page_end": null,
      "verification_status": "human_verified",
      "verification_notes": "Chapter 15 heading.",
      "benchmark_status": "scored"
    },
    {
      "node_id": "tm_ch_16",
      "parent_id": null,
      "title": "Chapter 16",
      "type": "chapter",
      "level": 1,
      "order": 16,
      "page_start": 142,
      "page_end": null,
      "verification_status": "human_verified",
      "verification_notes": "Chapter 16 heading.",
      "benchmark_status": "scored"
    },
    {
      "node_id": "tm_epilogue",
      "parent_id": null,
      "title": "Epilogue",
      "type": "epilogue",
      "level": 1,
      "order": 17,
      "page_start": 147,
      "page_end": 150,
      "verification_status": "human_verified",
      "verification_notes": "Epilogue concluding narrative.",
      "benchmark_status": "scored"
    }
  ]
}