{
  "document_id": "001_middlemarch",
  "title": "Middlemarch",
  "author": "George Eliot",
  "source_file": "2015.42254.Middlemarch.pdf",
  "edition_notes": "Scanned bitmap archive edition (638 pages, published ~1871-1872). Raw character extraction yields 0 characters without OCR. Structural verification against physical scan text is pending OCR enablement.",
  "human_verified": false,
  "verification_coverage": "extraction_limitation_deferred",
  "structural_notes": "Standard literary reference structure comprises a Prelude, 8 Books (each containing chapters), and a Finale. In this specific PDF, text is completely un-extracted (image-only scan). Chapter-level and Book-level structure are deferred from scoring until OCR is available.",
  "scored_levels": [],
  "deferred_levels": [
    "book",
    "chapter"
  ],
  "benchmark_status": "extraction_limitation",
  "nodes": [
    {
      "node_id": "mm_prelude",
      "parent_id": null,
      "title": "Prelude",
      "type": "preface",
      "level": 1,
      "order": 1,
      "page_start": null,
      "page_end": null,
      "verification_status": "candidate",
      "verification_notes": "Known canonical structural node; unverified in source PDF due to 0-char extraction limitation.",
      "benchmark_status": "deferred"
    },
    {
      "node_id": "mm_book_1",
      "parent_id": null,
      "title": "Book I. Miss Brooke",
      "type": "book",
      "level": 1,
      "order": 2,
      "page_start": null,
      "page_end": null,
      "verification_status": "candidate",
      "verification_notes": "Canonical Book I; unverified in source PDF due to 0-char extraction limitation.",
      "benchmark_status": "deferred"
    },
    {
      "node_id": "mm_book_2",
      "parent_id": null,
      "title": "Book II. Old and Young",
      "type": "book",
      "level": 1,
      "order": 3,
      "page_start": null,
      "page_end": null,
      "verification_status": "candidate",
      "verification_notes": "Canonical Book II; unverified in source PDF due to 0-char extraction limitation.",
      "benchmark_status": "deferred"
    },
    {
      "node_id": "mm_book_3",
      "parent_id": null,
      "title": "Book III. Waiting for Death",
      "type": "book",
      "level": 1,
      "order": 4,
      "page_start": null,
      "page_end": null,
      "verification_status": "candidate",
      "verification_notes": "Canonical Book III; unverified in source PDF due to 0-char extraction limitation.",
      "benchmark_status": "deferred"
    },
    {
      "node_id": "mm_book_4",
      "parent_id": null,
      "title": "Book IV. Three Love Problems",
      "type": "book",
      "level": 1,
      "order": 5,
      "page_start": null,
      "page_end": null,
      "verification_status": "candidate",
      "verification_notes": "Canonical Book IV; unverified in source PDF due to 0-char extraction limitation.",
      "benchmark_status": "deferred"
    },
    {
      "node_id": "mm_book_5",
      "parent_id": null,
      "title": "Book V. The Dead Hand",
      "type": "book",
      "level": 1,
      "order": 6,
      "page_start": null,
      "page_end": null,
      "verification_status": "candidate",
      "verification_notes": "Canonical Book V; unverified in source PDF due to 0-char extraction limitation.",
      "benchmark_status": "deferred"
    },
    {
      "node_id": "mm_book_6",
      "parent_id": null,
      "title": "Book VI. The Widow and the Wife",
      "type": "book",
      "level": 1,
      "order": 7,
      "page_start": null,
      "page_end": null,
      "verification_status": "candidate",
      "verification_notes": "Canonical Book VI; unverified in source PDF due to 0-char extraction limitation.",
      "benchmark_status": "deferred"
    },
    {
      "node_id": "mm_book_7",
      "parent_id": null,
      "title": "Book VII. Two Temptations",
      "type": "book",
      "level": 1,
      "order": 8,
      "page_start": null,
      "page_end": null,
      "verification_status": "candidate",
      "verification_notes": "Canonical Book VII; unverified in source PDF due to 0-char extraction limitation.",
      "benchmark_status": "deferred"
    },
    {
      "node_id": "mm_book_8",
      "parent_id": null,
      "title": "Book VIII. Sunset and Sunrise",
      "type": "book",
      "level": 1,
      "order": 9,
      "page_start": null,
      "page_end": null,
      "verification_status": "candidate",
      "verification_notes": "Canonical Book VIII; unverified in source PDF due to 0-char extraction limitation.",
      "benchmark_status": "deferred"
    },
    {
      "node_id": "mm_finale",
      "parent_id": null,
      "title": "Finale",
      "type": "epilogue",
      "level": 1,
      "order": 10,
      "page_start": null,
      "page_end": null,
      "verification_status": "candidate",
      "verification_notes": "Canonical Finale; unverified in source PDF due to 0-char extraction limitation.",
      "benchmark_status": "deferred"
    }
  ]
}